,Title,ROUND,Paragraph,speaker,speaker_title,speaker_role,text
55,"Dow Inc., Q1 2020 Earnings Call, Apr 30, 2020",QA,55,Arun Shankar Viswanathan,"RBC Capital Markets, Research Division",ANALYSTS,"I guess I just wanted to ask about both polyethylene and polyurethanes. Both markets have gone through some structural changes here, polyethylene on the feedstock side and potentially demand side; polyurethanes on the demand side with maybe reduced demand for consumer discretionary items. I guess, would you agree with those characterizations? And I guess, when you think about that, thinking longer term, do you foresee any changes in your strategy? In polyurethanes, you've talked about adding systems houses and PE, you talked about selling up. Are those still valid in this environment? Have you seen new customers trade down or change their strategy as well?"
56,"Dow Inc., Q1 2020 Earnings Call, Apr 30, 2020",QA,56,James R. Fitterling,CEO & Chairman,EXECUTIVES,"Arun, I think we'll get back to the growth playbook, as we mentioned in the script. And I think it's just a matter of timing here. So it doesn't make sense right now to continue to plow cash and the capacity when the demand in Europe and North America and Latin America has slowed down because people are staying at home. So that's why we're taking some of the actions that we're taking right now, it's just to balance that demand. But that demand will come back. People are not going to stay at home forever. We're helping governments right now with safe ways to return to work. And we're operating safely 14,000 Dow people go to the sites every day, and we're operating safely and people are healthy."
57,"Dow Inc., Q1 2020 Earnings Call, Apr 30, 2020",QA,57,James R. Fitterling,CEO & Chairman,EXECUTIVES,"So we know it can be done, but it's just going to take some time before the consumer confidence to come back. And that's why we're doing what we're doing. Downstream expansions in our Industrial Solutions and in our functional silicones products are still continuing. Systems house will come back as the automotive business and the installation and construction business comes back, and we'll continue to look at downstream on plastics."
58,"Dow Inc., Q1 2020 Earnings Call, Apr 30, 2020",QA,58,Operator,,,"And that will conclude today's question-and-answer session. At this time, I would like to turn the call back over to Colleen Kay for any additional or closing remarks."
59,"Dow Inc., Q1 2020 Earnings Call, Apr 30, 2020",QA,59,Colleen Kay,Vice President of Investor Relations,EXECUTIVES,"Thank you, everyone, for joining our call today. We appreciate your interest in Dow. For your reference, a copy of our transcript will be posted on Dow's website within 24 hours. This concludes our call, and have a safe day."
60,"Dow Inc., Q1 2020 Earnings Call, Apr 30, 2020",QA,60,Colleen Kay,Vice President of Investor Relations,EXECUTIVES,And that will conclude today's call. We thank you for your participation. You may now disconnect.
