,Title,ROUND,Paragraph,speaker,speaker_title,speaker_role,text
49,"Dow Inc., Q1 2020 Earnings Call, Apr 30, 2020",Presentation,49,Howard I. Ungerleider,President & CFO,EXECUTIVES,"With that being said, let's move to Slide 13, where we highlight adjustments to the full year items we shared in January based on current realities. As Jim mentioned in his comments, our 2020 earnings should benefit from tailwinds of $350 million of expense reductions. We expect higher equity losses as our JVs also face similar trends as our core business. And we now expect a higher tax rate due to shifts in the geographic mix of earnings in our core business as well as lower equity earnings."
50,"Dow Inc., Q1 2020 Earnings Call, Apr 30, 2020",Presentation,50,Howard I. Ungerleider,President & CFO,EXECUTIVES,"To preserve flexibility in this slower macro environment, we have reduced our CapEx spending target by $750 million versus 2019. We will have a cash tailwind of more than $400 million related to lower integration and separation costs for the balance of the year. And as I mentioned before, we have put further share repurchases temporarily on hold at least until we get better visibility on cash flow."
51,"Dow Inc., Q1 2020 Earnings Call, Apr 30, 2020",Presentation,51,Howard I. Ungerleider,President & CFO,EXECUTIVES,"Getting into the details of the quarter ahead, let's please turn to Slide 14. We see second quarter sales in the range of $7.5 billion to $8.5 billion on our assumption of demand production peaking in the second quarter with the spread of COVID-19 and slowing economic activity globally. We have outlined on the slide our current sales expectations by segment in our normal fashion."
52,"Dow Inc., Q1 2020 Earnings Call, Apr 30, 2020",Presentation,52,Howard I. Ungerleider,President & CFO,EXECUTIVES,"We're also providing corridors this quarter, along with high- and low-volume estimates so you understand the range of scenarios we see as possible for each segment. This is an attempt to give you a level of forward visibility in a very difficult period of forecast. Let me please reemphasize, though, these are estimates only."
53,"Dow Inc., Q1 2020 Earnings Call, Apr 30, 2020",Presentation,53,Howard I. Ungerleider,President & CFO,EXECUTIVES,"As usual, we're highlighting the key EBIT drivers in the quarter on a sequential basis. In the Packaging & Specialty Plastics segment, while we expect continued robust consumer-driven demand for our food, health and hygiene and packaging applications, we see this being more than offset by demand softness in automotive and infrastructure applications as well as lower average energy prices. With the dramatic shift in oil dynamics, we expect naphtha cracking to continue its advantage, which should support our European cracker margins as well as keep demand relatively resilient there. And our actions in the Americas to idle capacity should help balance supply and demand until the economies around the world reopen."
54,"Dow Inc., Q1 2020 Earnings Call, Apr 30, 2020",Presentation,54,Howard I. Ungerleider,President & CFO,EXECUTIVES,"In the Industrial Intermediates & Infrastructure segment, we're seeing high demand in the Industrial Solutions for our solvent and surfactants that make cleaning products effective to combat COVID-19. However, we expect that to only partly offset trough MDI spreads and weakness in end-market demand for our polyurethane products, particularly in consumer durable, construction and automotive applications."
55,"Dow Inc., Q1 2020 Earnings Call, Apr 30, 2020",Presentation,55,Howard I. Ungerleider,President & CFO,EXECUTIVES,"And finally, in Performance Materials & Coatings, we expect demand softness for industrial applications and coatings as well as weakened fundamentals in our upstream siloxanes and acrylic building blocks, which are experiencing a challenging pricing environment on weak supply and demand fundamentals."
56,"Dow Inc., Q1 2020 Earnings Call, Apr 30, 2020",Presentation,56,Howard I. Ungerleider,President & CFO,EXECUTIVES,"During the second quarter, we also anticipate we will begin to feel the positive effects of China continuing to slowly reverse the declines of the first quarter. And as the global economy continues to come back online beyond the second quarter, we also expect to see the discrete impacts related to the virus begin to reverse globally."
57,"Dow Inc., Q1 2020 Earnings Call, Apr 30, 2020",Presentation,57,Howard I. Ungerleider,President & CFO,EXECUTIVES,"I'd like to just stress again that the near-term guidance you see here is based on our assumptions for how the COVID-19 containment and recovery could play out as we move through the second quarter and are based on the outlined assumptions. Given the limited visibility, we will remain strongly focused on cash flow and protecting our enterprise priorities."
58,"Dow Inc., Q1 2020 Earnings Call, Apr 30, 2020",Presentation,58,Howard I. Ungerleider,President & CFO,EXECUTIVES,"With that, I'll turn it back to Jim."
59,"Dow Inc., Q1 2020 Earnings Call, Apr 30, 2020",Presentation,59,James R. Fitterling,CEO & Chairman,EXECUTIVES,"Thank you, Howard. Turning to Slide 15. I want to emphasize several factors that we believe set Dow apart and support our competitive position. Given our more than 120-year history, Dow has a strong track record of successfully navigating periods of uncertainty. And as a result, we have built competitive positions and asset flexibility to be prepared for situations like those that we're experiencing today. We call these our points of distinction. And today, I will highlight a few points that set Dow apart."
60,"Dow Inc., Q1 2020 Earnings Call, Apr 30, 2020",Presentation,60,James R. Fitterling,CEO & Chairman,EXECUTIVES,"On Slide 16, Dow's unmatched feedstock flexibility and superior product mix are key factors that underpin the higher and more resilient margins that we deliver across the cycle. We also have a geographic mix of assets that provide a structural hedge to feedstock dynamics. For example, in today's environment, we're able to capture improved cracking margins in Europe and Southeast Asia, which offset some of the margin compression we see in other regions. We have a leading Packaging & Specialty Plastics portfolio with assets designed to be flexible and adapt to feedstock volatility."
61,"Dow Inc., Q1 2020 Earnings Call, Apr 30, 2020",Presentation,61,James R. Fitterling,CEO & Chairman,EXECUTIVES,"Our feedstock flexibility enables us to crack a wider mix of feedstocks. For example, we have 2 to 3x more propane capability than our peers. We can implement this at a furnace-by-furnace level in our crackers. As heavier feedstocks like naphtha become advantaged, another limitation could be co-products. If not managed adequately, ethylene units may be forced to cut rates or switch feedstock. And we've seen some signs of these strains in the industry as demand for co-products are tied to automotive and fuel end markets, which are currently experiencing weak demand. But here, too, Dow has advantages."
62,"Dow Inc., Q1 2020 Earnings Call, Apr 30, 2020",Presentation,62,James R. Fitterling,CEO & Chairman,EXECUTIVES,"We have aromatics processing units in Europe and on the U.S. Gulf Coast, which give us flexibility to consume and process Thai gas from the crackers. We have capabilities of handling increased C4 streams from the cracker, which includes co-cracking to reprocess the C4 in our furnaces. In short, our feedstock flexibility and co-product management capabilities prove their worth over the cycle time and time again, and this period is no different. These capabilities preserve our low cost-to-serve position regardless of which feedstock scenario is advantaged."
63,"Dow Inc., Q1 2020 Earnings Call, Apr 30, 2020",Presentation,63,James R. Fitterling,CEO & Chairman,EXECUTIVES,"Further downstream, our product mix is another differentiating factor. Our mix of polyethylene and functional polymers products delivers a more resilient and higher-margin profile, which begins to stand out in softer periods like we started to see in 2019 and we are seeing today. The benchmarking we've delivered over the past 2 years has highlighted this performance as well. You can find our 2019 benchmarking data in the appendix of this earnings slide presentation and on Dow's investor website."
64,"Dow Inc., Q1 2020 Earnings Call, Apr 30, 2020",Presentation,64,James R. Fitterling,CEO & Chairman,EXECUTIVES,"Another point of distinction comes from the market segments that we've been targeting and the consumer orientation that we have in our products and solutions, which I'll cover on Slide 17. With our primary market verticals of packaging, infrastructure and consumer care, our business portfolio is tilted towards the consumer. And in today's situation, we find that a substantial part of our business is essential to some of the most critical end markets that consumers value."
65,"Dow Inc., Q1 2020 Earnings Call, Apr 30, 2020",Presentation,65,James R. Fitterling,CEO & Chairman,EXECUTIVES,"Related to the pandemic, Dow has a breadth of solutions that are in high demand. We see a strong pull in applications such as intermediates for cleaning products, pharmaceutical ingredients, packaging and nonwovens for gowns, wipes and masks, and food packaging to secure the freshness and safety of our food supply. These are moments when our materials science expertise and technologies prove their worth and play a significant role."
66,"Dow Inc., Q1 2020 Earnings Call, Apr 30, 2020",Presentation,66,James R. Fitterling,CEO & Chairman,EXECUTIVES,"For example, in the pharmaceutical and health and hygiene markets alone, the following are examples of just some of the products enabled by materials science innovation and our diverse set of chemistries: silicone technologies that enable disposable gloves and tissues, detergents and hard surface cleaners, soaps and shampoos; plastics that are vital for syringes, medical tubes, vials, hoses, valves, device and pharma packaging, drapes, gloves and gowns; polyurethane solutions used for hospital bedding, rigid insulation for medicine refrigeration and transport and safety issues; coatings applications for medical devices and tapes, potable water pipes, paper food packaging and paper cups; and our Industrial Solutions team recently found an innovative way to reconfigure existing underutilized assets to increase our volume of isopropyl alcohol by up to 50%. This is a critical raw material for hand sanitizers."
67,"Dow Inc., Q1 2020 Earnings Call, Apr 30, 2020",Presentation,67,James R. Fitterling,CEO & Chairman,EXECUTIVES,"Out of periods of change, new ways of living, working and staying healthy are developing across the diverse markets that we serve, such as improving the performance, comfort and convenience of PPE, smart building and infrastructure solutions for multipurpose spaces, restaurant takeout food packaging, home and surface care solutions and antimicrobials. Dow's materials science know-how and strong design collaborations with customers can help enable new solutions to these developing market needs."
68,"Dow Inc., Q1 2020 Earnings Call, Apr 30, 2020",Presentation,68,James R. Fitterling,CEO & Chairman,EXECUTIVES,"On Slide 18, the last point of distinction I want to highlight is the global scale of our operations. This is something we often take for granted, but the year so far has emphasized just how much of an advantage it provides to our ability to meet customer demand, rapidly adjust and innovate and take advantage of with well-developed, agile, regional supply chains and a deep understanding of the needs of our customers in all of our markets."
69,"Dow Inc., Q1 2020 Earnings Call, Apr 30, 2020",Presentation,69,James R. Fitterling,CEO & Chairman,EXECUTIVES,"Our geographic diversity serves as a natural hedge for our business operations and uniquely positions us to shine in times of crisis and uncertainty. In fact, all of these strengths were on display in the first quarter as our teams rapidly worked through regional and global supply chain complexity, manufacturing limitations and shifting consumer trends. And as we move through the rest of the year, I see these strengths continuing to provide Dow with unique advantages. Altogether, Dow's points of distinction, unmatched feedstock flexibility, a superior product mix, participation in critical end markets and geographic diversity, set us apart and give us a competitive edge today and throughout the cycle."
70,"Dow Inc., Q1 2020 Earnings Call, Apr 30, 2020",Presentation,70,James R. Fitterling,CEO & Chairman,EXECUTIVES,"In summary, Dow is prepared for what's ahead. Our balance sheet is strong, and we have plenty of liquidity to meet our obligations with no significant long-term debt due over the next few years. We continue to take proactive and thoughtful actions, both operationally and financially, with a focus on safety and cash flow, which we firmly believe will serve us well through this period. We have unique points of distinction that differentiate Dow and position us for upside when the economic recovery begins. We have a remarkable team who continues to inspire and deliver every day, and we are focused on navigating through this challenging time, emerging even stronger and continuing to execute our growth playbook. With that, I'll turn it back to Colleen to open the Q&A."
