,Title,ROUND,Paragraph,speaker,speaker_title,speaker_role,text
0,"PAVmed Inc., Q4 2019 Earnings Call, Apr 09, 2020",Presentation,0,Operator,,,"Greetings, and welcome to the PAVmed Inc. Business Update Conference Call. [Operator Instructions] As a reminder, this conference is being recorded."
1,"PAVmed Inc., Q4 2019 Earnings Call, Apr 09, 2020",Presentation,1,Mike Havrilla,Director of Investor Relations,EXECUTIVES,"I would now like to turn the conference over to Mike Havrilla, Director of Investor Relations for PAVmed. Thank you. Please begin."
2,"PAVmed Inc., Q4 2019 Earnings Call, Apr 09, 2020",Presentation,2,Mike Havrilla,Director of Investor Relations,EXECUTIVES,"Good afternoon, everyone. This is Mike Havrilla, PAVmed's Director of Investor Relations. Thank you all for participating in today's business update conference call. Joining me today on the call are Dr. Lishan Aklog, Chairman and CEO; Dennis McGrath, Chairman -- sorry, President and Chief Financial Officer."
3,"PAVmed Inc., Q4 2019 Earnings Call, Apr 09, 2020",Presentation,3,Mike Havrilla,Director of Investor Relations,EXECUTIVES,"Before we begin, I'd like to caution that comments made during the call by management will contain forward-looking statements regarding the operations and future results of PAVmed. I encourage you to read the company's filings with the Securities and Exchange Commission, which identifies specific factors that may cause actual results or events to differ materially from those described in the forward- looking statements. Factors that may affect the company's results include, but are not limited to, the uncertainties inherent in research and development, including the cost and time required to advance products to regulatory submission; whether and when products are cleared by regulatory authorities; market acceptance of products once cleared and commercialized; company's ability to raise additional capital; and the competitive environment."
4,"PAVmed Inc., Q4 2019 Earnings Call, Apr 09, 2020",Presentation,4,Mike Havrilla,Director of Investor Relations,EXECUTIVES,"PAVmed has not yet received clearance from the FDA or other regulatory bodies to market many of its products. New risks and uncertainties may arise from time to time are difficult to predict. All these factors are difficult and impossible to predict accurately, many of them are beyond the company's control. For a further list and description of these and other important risks and uncertainties that may affect future operations, see Part I Item 1A entitled Risk Factors in PAVmed's most recent annual report on Form 10-K filed with the SEC, any subsequent updates filed quarterly reports on Form 10-Q."
5,"PAVmed Inc., Q4 2019 Earnings Call, Apr 09, 2020",Presentation,5,Mike Havrilla,Director of Investor Relations,EXECUTIVES,"Except as required by law, PAVmed disclaims any intention or obligation to publicly update or revise any forward-looking statements to reflect changes in expectations or in events, conditions or circumstances on which those expectations may be based or that the likelihood -- actual results would differ from those contained in the forward-looking statements."
6,"PAVmed Inc., Q4 2019 Earnings Call, Apr 09, 2020",Presentation,6,Mike Havrilla,Director of Investor Relations,EXECUTIVES,"As a note, we have just submitted our press release, which should be distributed shortly by our partner and that will be forthcoming."
7,"PAVmed Inc., Q4 2019 Earnings Call, Apr 09, 2020",Presentation,7,Mike Havrilla,Director of Investor Relations,EXECUTIVES,"With that said, I'd like to turn the call over to Lishan Aklog. Dr. Aklog."
8,"PAVmed Inc., Q4 2019 Earnings Call, Apr 09, 2020",Presentation,8,Lishan Aklog,Chairman & CEO,EXECUTIVES,"Thank you, Mike. Good afternoon, everyone, and thank you for joining us on this quarterly call to update you on our business and discuss our recent financial results. Those of you who have been keeping up with our press releases know that we have been extraordinarily active in the months since our last update, with many exciting accomplishments and even more milestones we look forward to in the upcoming months."
9,"PAVmed Inc., Q4 2019 Earnings Call, Apr 09, 2020",Presentation,9,Lishan Aklog,Chairman & CEO,EXECUTIVES,"Let me start first with a few words about the enormous challenges we are all facing as a result of the COVID-19 pandemic, which, in just a few months, has exacted a tremendous human and economic toll on our industry, on our nation and on our Board. I hope and pray that all of you are weathering the level of storm as best you can and are keeping yourselves and your loved ones safe. I am deeply moved that many of you have taken the time to reach out to us to express your support and continued confidence in us as well as to express your concerns for our safety and health. Thankfully, all members of the PAVmed family, including our employees and critical partners are healthy, safe and able to continue their important work. We are very fortunate that our corporate structure and culture are well suited to address these challenges with minimal short-term and no anticipated long-term disruptions to our strategic plan."
10,"PAVmed Inc., Q4 2019 Earnings Call, Apr 09, 2020",Presentation,10,Lishan Aklog,Chairman & CEO,EXECUTIVES,"For example, our employees and partners are already dispersed over many states across the nation and are already proficient and productively utilizing modern remote collaboration tools, which they've been doing since our inception. In addition, our team has always embraced a sort of special forces type culture as all members able to operate autonomously when necessary and spontaneously collaborate to address short-term challenges as they arise, while still systematically advancing and executing on our long-term strategic plan."
11,"PAVmed Inc., Q4 2019 Earnings Call, Apr 09, 2020",Presentation,11,Lishan Aklog,Chairman & CEO,EXECUTIVES,"Before providing you with updates on our product portfolio, I'd like to give you a general summary of how each area of our business has or has not been affected by the pandemic and how we are responding for those that are affected."
12,"PAVmed Inc., Q4 2019 Earnings Call, Apr 09, 2020",Presentation,12,Lishan Aklog,Chairman & CEO,EXECUTIVES,"First, financial and administrative perspective. As we previously announced, and as Dennis will explain in more detail shortly, we recently completed the November 2019 convertible note financing, which strengthens our balance sheet and enables us to fund our full strategic plan for the foreseeable future as we advance through upcoming milestones. We are also confident that we'll be able to continue to finance our operations as required until we begin to generate meaningful revenue through commercial sales or non-dilutive financing through M&A activities."
13,"PAVmed Inc., Q4 2019 Earnings Call, Apr 09, 2020",Presentation,13,Lishan Aklog,Chairman & CEO,EXECUTIVES,"Our executive leadership team has implemented a cash management plan focused on preserving cash in areas where activities are inevitably throttled as a result of the lockdown. Our full-time headcount remains lean, our employees and the unique expertise they bring to our efforts are understandably our most critical resource that we do not plan to trim payroll. This makes us eligible for the Paycheck Protection Program within the federal stimulus package. We have already completed the application and, if approved, will result in proceeds of approximately $300,000 structured as a forgivable loan."
14,"PAVmed Inc., Q4 2019 Earnings Call, Apr 09, 2020",Presentation,14,Lishan Aklog,Chairman & CEO,EXECUTIVES,"On the product development and manufacturing side, we currently utilize over a dozen partners across the U.S. in the design, development, testing and manufacture of our product. All these partners are designated essential services, remaining fully operational with no meaningful disruption in their activities on our behalf. Our supply chain has also remained intact, and we believe it will continue to do so without any disruption. The only 2 components we source outside of the U.S. are 2 electrical parts of our CarpX device we sourced in China. Although we already had sufficient inventory of these parts to get us through initial CarpX commercialization, these manufacturers are already back online following a short COVID-19 disruption earlier this year."
15,"PAVmed Inc., Q4 2019 Earnings Call, Apr 09, 2020",Presentation,15,Lishan Aklog,Chairman & CEO,EXECUTIVES,"What about on the regulatory front? We, with the help of our regulatory consultants, have multiple active engagements with the U.S. FDA, including for CarpX, PortIO, EsoGuard and EsoCheck. We also have the FDA."
16,"PAVmed Inc., Q4 2019 Earnings Call, Apr 09, 2020",Presentation,16,Lishan Aklog,Chairman & CEO,EXECUTIVES,"I'm happy to report that none of this work has been materially impacted by COVID-19. Our regulatory consultants are fully operational using remote collaboration tools, the FDA reviewers assigned to our products are also working remotely, and based on ongoing informal communication, appear to have a bandwidth to work on our applications. Some initial concerns that assigned staff would be diverted to COVID-19-related work has not materialized. Most importantly, we have not received any formal or informal indication that we should expect any COVID-19-related delays in the review process."
17,"PAVmed Inc., Q4 2019 Earnings Call, Apr 09, 2020",Presentation,17,Lishan Aklog,Chairman & CEO,EXECUTIVES,"Two areas where we have had to actively manage COVID-19-related disruptions are our commercial and clinical research activity. On the commercial side, the fundamental challenge that we and essentially all medical device companies are currently facing is that the health care system is obviously overwhelmed by the pandemic. The system has been forced to divert resources and drastically modify operations to care for COVID-19 patients while protecting health care workers. Nonemergency care, including surgical and diagnostic procedures have essentially come to a standstill. Although we can't predict when the engine will start-up again, it is reasonable to assume that non-COVID-19 health care will be among the first things to come back online since one cannot and definitely defer necessary but nonemergency procedures."
18,"PAVmed Inc., Q4 2019 Earnings Call, Apr 09, 2020",Presentation,18,Lishan Aklog,Chairman & CEO,EXECUTIVES,"I will discuss our EsoGuard commercial activities later, but I am proud to report that Shaun O'Neil, our Chief Commercial Officer, and his team have rapidly adapted to the situation on the ground in pretty remarkable ways. Recruitment of independent sales reps has been unaffected, and their sales training has actually moved virtual without missing a beat. So as sales calls with physicians who are -- which are also being held virtually. Many of the target physicians are, in fact, well positioned to participate in virtual sales call because they are working from home or from their offices using telemedicine and are not necessarily on the front line of the COVID-19."
19,"PAVmed Inc., Q4 2019 Earnings Call, Apr 09, 2020",Presentation,19,Lishan Aklog,Chairman & CEO,EXECUTIVES,"They mentioned another area that we're managing is our clinical research activity. Life sciences companies face the same challenges with clinical research activities as with commercial activity. Nearly all non- COVID-related clinical research has come to a grinding halt nationwide, including intramural academic research trials and corporate-sponsored trials by large and small companies. We have active or soon to be active clinical trials involving multiple products, including EsoGuard, EsoCheck and PortIO, which are affected by this freeze. I will update these individually a bit later."
20,"PAVmed Inc., Q4 2019 Earnings Call, Apr 09, 2020",Presentation,20,Lishan Aklog,Chairman & CEO,EXECUTIVES,"Although for the time being, patients cannot be enrolled and procedures cannot be performed, our clinical research team, led by Randy Brown, has done a similarly remarkable job of making sure that we continue to advance the ball where we can so that we are poised to make up for lost time when things eventually open up again. For example, all of these studies, we -- for all of these studies, we continue to work with IRBs on protocol approval and with medical centers on negotiating and executing clinical trial agreement. Some principal investigators continue to actually actively recruit patients so they are ready to officially enroll once we are back online."
21,"PAVmed Inc., Q4 2019 Earnings Call, Apr 09, 2020",Presentation,21,Lishan Aklog,Chairman & CEO,EXECUTIVES,"Let's go through some of our recent accomplishments and upcoming activities and milestones. Let me start by highlighting some of these. In December, our majority owned subsidiary, Lucid Diagnostics, launched our EsoGuard Esophageal DNA test as the first and only commercially available DNA test to facilitate the detection of Barrett's esophagus with or without dysplasia as well as the esophageal cancer."
22,"PAVmed Inc., Q4 2019 Earnings Call, Apr 09, 2020",Presentation,22,Lishan Aklog,Chairman & CEO,EXECUTIVES,"In January, we launched 2 multicenter clinical trials to support future regulatory clearance of EsoGuard and EsoCheck as an FDA-registered In-Vitro Diagnostic or IVD. The first patient was enrolled and underwent their procedures in February. Also in January, we held a successful presubmission meeting with the FDA on our PortIO product, focused on the design of a clinical safety study in support of a de novo application."
23,"PAVmed Inc., Q4 2019 Earnings Call, Apr 09, 2020",Presentation,23,Lishan Aklog,Chairman & CEO,EXECUTIVES,"February brought many additional Lucid accomplishments. We are excited to receive FDA breakthrough device designation for EsoGuard and EsoCheck, which, in addition to validating their potential life-saving impact, provides priority expedited FDA assessment and review and potentially accelerated CMS coverage. We entered into successful -- sorry, we entered into sponsored clinical research agreements with 2 major academic centers: the Fred Hutchinson Cancer Research Center in Seattle, Washington; and the University of Pennsylvania in Philadelphia to evaluate EsoCheck in both Barrett's Esophagus progression and eosinophilic esophagitis."
24,"PAVmed Inc., Q4 2019 Earnings Call, Apr 09, 2020",Presentation,24,Lishan Aklog,Chairman & CEO,EXECUTIVES,"We also announced a new product, our EsoCure Esophageal Ablation Device, a disposable single-use thermal balloon ablation catheter, which is designed to use our patented Caldus Technology to treat this dysplastic Barrett's before it can progress to highly lethal esophageal cancer and to do so without the need for complex and expensive capital equipment."
25,"PAVmed Inc., Q4 2019 Earnings Call, Apr 09, 2020",Presentation,25,Lishan Aklog,Chairman & CEO,EXECUTIVES,"We also participated in 2 successful meetings with the Medicare contractor, Palmetto GBA, and its molecular diagnostics program, MolDx, one in February, focused on EsoGuard payment and another 2 weeks ago focused on EsoGuard coverage."
26,"PAVmed Inc., Q4 2019 Earnings Call, Apr 09, 2020",Presentation,26,Lishan Aklog,Chairman & CEO,EXECUTIVES,"In March, the FDA accepted our 510(k) resubmission for CarpX -- for our CarpX minimally invasive carpal tunnel device, incorporating data from our first -- from our successful first-in-human CarpX clinical safety study. Also in March, EsoCheck was honored as a Silver winner of the 2020 Edison award."
27,"PAVmed Inc., Q4 2019 Earnings Call, Apr 09, 2020",Presentation,27,Lishan Aklog,Chairman & CEO,EXECUTIVES,"This month, we completed training of our first cohort of 24 highly experienced independent gastroenterology sales representatives, covering a large swath of the country, who are now actively engaging with longtime physician partners on EsoGuard and EsoCheck. And just yesterday, despite the pandemic and a massive regulatory backlog in Europe due to systematic changes, we received a firm date in June for the stage 1 audit of our quality system by our EU notified body, which allows us to restart our efforts to pursue EU CE Mark clearance of CarpX and PortIO."
28,"PAVmed Inc., Q4 2019 Earnings Call, Apr 09, 2020",Presentation,28,Lishan Aklog,Chairman & CEO,EXECUTIVES,"Finally, as always, we continue to expand and advance our extensive intellectual property portfolio, which now includes 129 issued and pending patents, assigned or licensed to PAVmed and its subsidiaries. And we continue to have the success of securing allowances and advancing prosecutions."
29,"PAVmed Inc., Q4 2019 Earnings Call, Apr 09, 2020",Presentation,29,Lishan Aklog,Chairman & CEO,EXECUTIVES,"We have many key upcoming activities and milestones for us to look forward to in the coming months. Here are a few highlights. We expect to receive a response from the FDA on our CarpX 510(k) resubmission sometime during their 90-day substantive review window, which extends into June. Despite the limitations imposed by COVID-19, we will be accelerating and expanding our commercial activities for EsoGuard, including virtual sales and professional education as well as aggressive marketing, targeting physicians and patients to strengthen brand recognition, generate awareness of underlying conditions and support the sales process. We will continue to aggressively pursue our discussions with Palmetto GBA and other Medicare contractors and hope to secure payment and coverage decisions for EsoGuard's CPT code as soon as possible."
30,"PAVmed Inc., Q4 2019 Earnings Call, Apr 09, 2020",Presentation,30,Lishan Aklog,Chairman & CEO,EXECUTIVES,"Once the COVID-19 limitations begin to receive, we will restart both our commercial and clinical EsoGuard procedures and enrollment in our 2 IVD clinical trials. We'll also launch 4 additional clinical trials, involving EsoCheck and PortIO, which are currently on hold. We also have several very active M&A and partnership discussions involving NextFlo, EsoGuard, EsoCheck and DisappEAR, which I'll describe in more detail later, but which we hope to consummate in the coming months."
31,"PAVmed Inc., Q4 2019 Earnings Call, Apr 09, 2020",Presentation,31,Lishan Aklog,Chairman & CEO,EXECUTIVES,"Finally, we still hope to achieve a critical accuracy milestone and benchmark in animal testing of our majority owned subsidiary, Solys Diagnostics, noninvasive laser-based blood glucose diagnostics device."
32,"PAVmed Inc., Q4 2019 Earnings Call, Apr 09, 2020",Presentation,32,Lishan Aklog,Chairman & CEO,EXECUTIVES,"Now I'd like to now proceed to some more specific updates across our 4 divisions: GI Health, Minimally Invasive Interventions, Infusion Therapy and Emerging Innovations."
33,"PAVmed Inc., Q4 2019 Earnings Call, Apr 09, 2020",Presentation,33,Lishan Aklog,Chairman & CEO,EXECUTIVES,"Our GI Health division is building a portfolio of complementary products designed to diagnose and treat conditions of the esophagus, including a spectrum of conditions arising from chronic heartburn or gastroesophageal reflux disease leading to esophageal cancer as well as a prevalent inflammatory condition called eosinophilic esophagitis. Two products, EsoGuard and EsoCheck are commercially available. We hope to commercialize another product EsoCare in 2021. In addition, there are other potential pipeline products, which are the subject of active research programs within this division."
34,"PAVmed Inc., Q4 2019 Earnings Call, Apr 09, 2020",Presentation,34,Lishan Aklog,Chairman & CEO,EXECUTIVES,"Now let's start with EsoGuard and EsoCheck. We continue to make excellent progress on these 2 groundbreaking products less than 2 years after licensing them from our partners at Case Western Reserve University. EsoGuard and EsoCheck are designed to facilitate early detection of conditions leading to esophageal cancer in patients with chronic heartburn. It's important to understand these -- that these conditions lie in a spectrum. So chronic heartburn can lead to benign changes in the surface cells of their lower esophagus of Barrett's esophagus, which can transform into precancerous changes or dysplasia, which in turn can lead to highly lethal esophageal cancer."
35,"PAVmed Inc., Q4 2019 Earnings Call, Apr 09, 2020",Presentation,35,Lishan Aklog,Chairman & CEO,EXECUTIVES,"These are truly groundbreaking products. The National Cancer Institute highlighted them as one of the year's significant advancements in cancer's prevention in its 2020 reported progress. And as I mentioned, the FDA granted breakthrough device designation, which validates its potential life-saving impact. And EsoCheck, as I mentioned, was also recently recognized as a game-changing innovation and among the best new medical device products of the year by the Edison Awards honoring Thomas Edison."
36,"PAVmed Inc., Q4 2019 Earnings Call, Apr 09, 2020",Presentation,36,Lishan Aklog,Chairman & CEO,EXECUTIVES,"So briefly, how do they work? EsoCheck is an FDA-cleared cell collection device, which can perform targeted and protected sampling of cells from the lining of the lower esophagus as part of a 5-minute noninvasive office-based procedure. It serves as an alternative to an invasive upper endoscopy performed under anesthesia in a hospital or dedicated endoscopy center. EsoGuard is a highly accurate next- generation sequencing diagnostic assay, which detects methylation changes of 31 sites on 2 genes, which occur in patients along with Barrett's Esophagus to esophageal cancer spectrum. EsoGuard has performed on samples collected with EsoCheck and is commercially available in the United States as a Laboratory Developed Test or LDT."
37,"PAVmed Inc., Q4 2019 Earnings Call, Apr 09, 2020",Presentation,37,Lishan Aklog,Chairman & CEO,EXECUTIVES,"Although professional society practice guidelines recommend screening in over 10 million high-risk GERD patients to detect and treat Barrett's before it progresses to cancer, fewer than 10% actually undergo screening using invasive upper endoscopy. The tragedy of these conditions is that the vast majority of patients diagnosed with esophageal cancer are not aware that they have underlying Barrett's and that the progression of cancer could have been prevented through careful monitoring and treatment if the Barrett's had been diagnosed earlier. Sadly, over 80% of these esophageal cancer patients will die within 5 years of diagnosis."
38,"PAVmed Inc., Q4 2019 Earnings Call, Apr 09, 2020",Presentation,38,Lishan Aklog,Chairman & CEO,EXECUTIVES,"Based on very modest penetration of U.S. GERD patients currently recommended for Barrett's screening according to published guidelines and on a Deloitte market assessment we commissioned, we believe that the estimated addressable domestic market opportunity for these products is several billion dollars."
39,"PAVmed Inc., Q4 2019 Earnings Call, Apr 09, 2020",Presentation,39,Lishan Aklog,Chairman & CEO,EXECUTIVES,"The most important update for these products is on the commercial front. We are commercializing EsoGuard using a hybrid model with internal sales management, marketing and professional education, working closely with independent sales representatives across the country. And in addition to Shaun O'Neil, our Chief Commercial Officer, we have hired 2 outstanding regional sales managers covering the Eastern and Western U.S. and a fantastic Director of Marketing and Communications. As I previously mentioned, last week, we completed training of the first cohort, these 20 highly experienced sales reps cover most of the country. They are all senior professionals, averaging at least a dozen years in the field, calling on physicians on behalf of well-established leading companies in the space. Most bring deep long- standing relationships with gastroenterologists in their territories. They currently had access to their physicians through virtual sales calls despite the lockdown, and we are confident they'll be first in line once things open up."
40,"PAVmed Inc., Q4 2019 Earnings Call, Apr 09, 2020",Presentation,40,Lishan Aklog,Chairman & CEO,EXECUTIVES,"Several accounts that completed training had product on the shelf have performed procedures on patients before the shutdown of nonemergency procedures. Since then, our sales teams have been in discussions with well over 100 accounts who will be in an excellent position to begin performing procedures once things open up."
41,"PAVmed Inc., Q4 2019 Earnings Call, Apr 09, 2020",Presentation,41,Lishan Aklog,Chairman & CEO,EXECUTIVES,"As I mentioned earlier, we have initiated an aggressive marketing campaign of the professional journals and social media, targeting physicians and patients to strengthen EsoGuard and EsoCheck brand recognition. Engagement with these activities has been excellent, and the feedback has been very positive. We're also making solid progress on the reimbursement and coverage front. As we've previously mentioned, EsoGuard received a CPT code last year. We successfully advanced it through CMS process. We were granted gap-fill designation, which permits us to proceed with payment and coverage, discussions with designated Medicare contractors and private payers. As I mentioned, we had 2 successful meetings with Palmetto GBA and MolDx. We're working with our consultants to finalize a detailed dossier in support outcome."
