,Title,ROUND,Paragraph,speaker,speaker_title,speaker_role,text
42,"PAVmed Inc., Q4 2019 Earnings Call, Apr 09, 2020",Presentation,42,Lishan Aklog,Chairman & CEO,EXECUTIVES,"There are many additional exciting developments and future activities in this division. As I mentioned, we're excited about the progress we're making on a EsoCure Ablation Device. This, as I mentioned, is the disposable single-use thermal balloon ablation catheter, designed to advance through the working channel of a standard endoscope and uses our patented Caldus Technology to ablate the esophageal tissue. Once cleared and commercialized, EsoCure will allow physicians to treat dysplastic Barrett's before it could progress to cancer and do so without the need for complex and expensive capital equipment like current technologies from Medtronic and others do."
43,"PAVmed Inc., Q4 2019 Earnings Call, Apr 09, 2020",Presentation,43,Lishan Aklog,Chairman & CEO,EXECUTIVES,"We expect to complete development and FDA 510(k) submission to be secured by early 2021 and hope to have it commercialized later that year. As previously noted, we've launched these 2 international multicenter clinical trials, ESOGUARD-BE-1 and BE-2 to support future PMA submission for FDA registration of EsoGuard and EsoCheck as IVDs. One of the studies is a screening study of high-risk GERD patients, and the other is a case-control study of patients with known Barrett's or a more advanced condition. We have over 60 sites in the U.S. and Europe. Clinical trial enrollment has paused after the first patient was enrolled and underwent procedures last month. We have a couple of patients scheduled for later this month, but do not expect to be in full swing until clinical activities resume in the coming weeks and months across the country and in Europe."
44,"PAVmed Inc., Q4 2019 Earnings Call, Apr 09, 2020",Presentation,44,Lishan Aklog,Chairman & CEO,EXECUTIVES,"Meanwhile, our clinical research team is continuing to secure IRB approvals and complete contracts so we can make up for lost times when things open up. As I mentioned, we have 2 other additional EsoCheck clinical trials on hold with Fred Hutch one and the one with the University of Pennsylvania, and they are both -- we look forward to advancing those as things open up."
45,"PAVmed Inc., Q4 2019 Earnings Call, Apr 09, 2020",Presentation,45,Lishan Aklog,Chairman & CEO,EXECUTIVES,"Finally, we have 2 active partnership discussions involving GI Health products. We have a strong interest from an established diagnostic company outside the U.S. to perform and market EsoGuard in that region. We also have been offered the opportunity to license highly accurate eosinophilic esophagitis biomarkers from a major academic medical center for commercialization as an LDT. I expect this license agreement to be consummated soon."
46,"PAVmed Inc., Q4 2019 Earnings Call, Apr 09, 2020",Presentation,46,Lishan Aklog,Chairman & CEO,EXECUTIVES,"Let's move on to Minimally Invasive Interventions and our CarpX product. CarpX is our patented single- use disposable minimally invasive device, designed to treat carpal tunnel syndrome while reducing recovery times. The balloon catheter device is inserted under the scarred ligament, tensioning it while pushing the nerve and tendons away. When activated, bipolar radiofrequency electrodes precisely cut a ligament from the inside out in a matter of seconds. We believe CarpX will dramatically reduce recovery times compared to traditional open surgery, targeting an estimated $1 billion immediately addressable domestic market opportunity."
47,"PAVmed Inc., Q4 2019 Earnings Call, Apr 09, 2020",Presentation,47,Lishan Aklog,Chairman & CEO,EXECUTIVES,"We are seeking FDA 510(k) clearance to commercially market CarpX for minimally invasive carpal tunnel release. The FDA recommended a clinical safety study to support 510(k) resubmission, and we consulted closely with them during the development of the study protocol. As we've previously announced, the clinical safety study was successfully completed and incorporated into a 510(k) submission, which is currently under FDA review."
48,"PAVmed Inc., Q4 2019 Earnings Call, Apr 09, 2020",Presentation,48,Lishan Aklog,Chairman & CEO,EXECUTIVES,"Briefly, 20 carpal tunnel syndrome patients in New Zealand underwent successful CarpX, minimally invasive carpal tunnel release. All patients met the study's prespecified effectiveness endpoint, which was clinical device technical success, defined as the endoscopic confirmation of complete division of the transverse carpal ligament. CarpX consistently cut the ligament clearly and precisely without evidence of thermal spread beyond the targeted tissue cutline. Procedure times fell after a short learning curve, indicating that the procedure can be performed in the same or less time as traditional open surgery."
49,"PAVmed Inc., Q4 2019 Earnings Call, Apr 09, 2020",Presentation,49,Lishan Aklog,Chairman & CEO,EXECUTIVES,"Two weeks and 90-day postoperative follow-up rates were 100% and 95%, respectively, exceeding the targeted 80% rate recommended by the FDA. The only loss to follow-up was a patient who was documented to be back to normal with resolution symptoms at 6 weeks. He opted not to return to the study site for his 90-day follow-up visit because he was traveling a significant distance away and was overall satisfied with the procedure's outcome."
50,"PAVmed Inc., Q4 2019 Earnings Call, Apr 09, 2020",Presentation,50,Lishan Aklog,Chairman & CEO,EXECUTIVES,"All patients who completed follow-up met the study's prespecified primary safety endpoint, which was defined as device safety with no serious device-related adverse events. Patients underwent additional prespecified outcome assessments at baseline and during postoperative follow-on visit. These assessments use well-established, standardized and validated measures to assess patient satisfaction as well as changes in symptoms, motor and sensory function and neurophysiologic parameters following the procedure. The excellent results of these prespecified outcome assessments following CarpX were similar to or better-than-expected results from traditional open surgery."
51,"PAVmed Inc., Q4 2019 Earnings Call, Apr 09, 2020",Presentation,51,Lishan Aklog,Chairman & CEO,EXECUTIVES,"Since the FDA accepted our 510(k) resubmission application, we've received some informal communications with them and look forward to their formal response this quarter during the 90-day substantive review window, which extends to June."
52,"PAVmed Inc., Q4 2019 Earnings Call, Apr 09, 2020",Presentation,52,Lishan Aklog,Chairman & CEO,EXECUTIVES,"Now next, some brief highlights from our Infusion Therapy division, which includes PortIO and NextFlo. PortIO is our implantable intraosseus vascular access device, which allows direct access to the bone marrow to deliver medications, fluids and other substances. We are seeking an initial short-term implant duration indication through the FDA's de novo pathway. In January, we participated in a successful presubmission meeting with the FDA focused on the clinical protocol for a single -- for a small single- center clinical safety study in New Zealand and on the target population in our proposed label."
53,"PAVmed Inc., Q4 2019 Earnings Call, Apr 09, 2020",Presentation,53,Lishan Aklog,Chairman & CEO,EXECUTIVES,"The short-term clinical safety study as well as a long-term study we had planned to perform in Colombia, South America are both on hold due to travel and clinical limitations. We're continuing with the necessary administrative work, so we can proceed immediately to training and enrollment once these -- once things open up. And we're also exploring whether it might be advantageous to move the clinical safety study to the U.S. as an IDE study."
54,"PAVmed Inc., Q4 2019 Earnings Call, Apr 09, 2020",Presentation,54,Lishan Aklog,Chairman & CEO,EXECUTIVES,"Our NextFlo infusion system, just a brief comment about that. This system delivers highly accurate gravity-driven infusions independent of the height of the IV bag and seeks to eliminate the need for complex and expensive electronic infusion pumps for most of the estimated million infusions delivered in the United States each day. We are successfully advancing the NextFlo infusion test through design control development and testing with the goal of a 510(k) submission later this year."
55,"PAVmed Inc., Q4 2019 Earnings Call, Apr 09, 2020",Presentation,55,Lishan Aklog,Chairman & CEO,EXECUTIVES,"An exciting development that arose from M&A discussions with key strategics in the space has been an expansion of the applications using NextFlo as a platform technology. These are applications that we had always contemplated and are now pursuing at the request of these strategics. These applications include disposable infusion pumps for home use, packaged drug infusions, military and pharma applications and intravenous nutrition. Our M&A discussions remain active with several large companies in the space, and we look forward to consummating a deal as soon as possible."
56,"PAVmed Inc., Q4 2019 Earnings Call, Apr 09, 2020",Presentation,56,Lishan Aklog,Chairman & CEO,EXECUTIVES,"I wish I had more time to update you on exciting projects we're working on in our Emerging Innovations division, again, a few brief highlights. Our DisappEAR resorbable pediatric tubes, which are manufactured from aqueous silk and seek to revolutionize the care of the estimated 1 million children who undergo bilateral ear tube placement each year. We are very close to securing a commercial development and manufacturing relationship with a large multinational company, which has developed expertise and processing scope for commercial use. Their technique allows the ear tubes to be injection molded instead of machined, which greatly enhances the commercial potential of this product. And then as I briefly mentioned, our -- in our subsidiary, Solys Diagnostics, the research and development plan for our noninvasive laser-based blood glucose monitoring technology is progressing very well, and we expect to complete bench top and animal testing in the coming weeks."
57,"PAVmed Inc., Q4 2019 Earnings Call, Apr 09, 2020",Presentation,57,Lishan Aklog,Chairman & CEO,EXECUTIVES,"Our Emerging Innovations team is also working on several exciting products, including products in the ECMO cardiopulmonary support and ventilation areas. Both of these areas are highly relevant to the treatment of COVID-19 patients and other respiratory conditions."
58,"PAVmed Inc., Q4 2019 Earnings Call, Apr 09, 2020",Presentation,58,Lishan Aklog,Chairman & CEO,EXECUTIVES,I'll now pass the mic on to Dennis for a review of our financial results.
59,"PAVmed Inc., Q4 2019 Earnings Call, Apr 09, 2020",Presentation,59,Dennis M. McGrath,"President, CFO & Secretary",EXECUTIVES,"Thanks, Lishan, and good afternoon, everyone. I'll be brief as our financial results for the quarter and year ended December 31, 2019, were reported in our press release that was published just prior to the beginning of this call."
60,"PAVmed Inc., Q4 2019 Earnings Call, Apr 09, 2020",Presentation,60,Dennis M. McGrath,"President, CFO & Secretary",EXECUTIVES,"Our annual report on Form 10-K will be available at sec.gov and our website early next week. The complexities involved with accounting for the noncash charges related to our fourth quarter convertible debt financing, coupled with lawyers, auditors, consultants and staff working remotely, made the extension unavoidable. You'll recall that even as late as just last week, we completed the second half of the November 2019 financing, which Lishan spoke to, which also impacted the related registration statement that was filed in December and amended on March 30. The elongated registration process was impacted in part by the SEC's availability challenges as they were working at home as well. Nonetheless, the financial results I will be providing today are consistent with the preliminary results reported on March 30 as available to you and reported on Form 12b-25 extension filed at that time."
61,"PAVmed Inc., Q4 2019 Earnings Call, Apr 09, 2020",Presentation,61,Dennis M. McGrath,"President, CFO & Secretary",EXECUTIVES,"So with regards to the financial results, research and development expenses for the fourth quarter of 2019 were $2.3 million, up from about $1.4 million for the same period in 2018 and about $700,000 higher sequentially. The year-over-year increase reflects incremental hiring of Chief Medical Officer, Chief"
62,"PAVmed Inc., Q4 2019 Earnings Call, Apr 09, 2020",Presentation,62,Dennis M. McGrath,"President, CFO & Secretary",EXECUTIVES,"Operating Officer and Engineer PAVmed as well as clinical trial-related expenses, many of which Lishan just went through for CarpX and particularly EsoGuard is the early setup cost for the IVD clinical trial began in earnest in the fourth quarter."
63,"PAVmed Inc., Q4 2019 Earnings Call, Apr 09, 2020",Presentation,63,Dennis M. McGrath,"President, CFO & Secretary",EXECUTIVES,"General and administrative expenses were $2.3 million for the fourth quarter of 2019, compared with $1.9 million for the same period in 2018 and were higher by about $600,000 sequentially. The sequential increase reflects the financing transaction costs in the fourth quarter related to the November convertible debt financing. The year-over-year increase reflects an increase in compensation-related costs, particularly stock-based compensation, increased IP legal costs and an increase in Investor Relations activity."
64,"PAVmed Inc., Q4 2019 Earnings Call, Apr 09, 2020",Presentation,64,Dennis M. McGrath,"President, CFO & Secretary",EXECUTIVES,"PAVmed reported a net loss attributable to common stockholders of $6.3 million or a loss of $0.19 per common share. However, our press release provides substantially more detail related to the noncash charges occurring in the current and prior periods. Also, the press release provides a table entitled Non- GAAP Measures, which highlights these amounts along with interest expense and other noncash charges like depreciation, stock-based compensation, financing-related costs, should enable you to have a better understanding of the company's financial performance. You'll notice from the table that after adjusting the GAAP loss by these charges, the company reported a non-GAAP adjusted loss for the 3 months ended December 31 of $3.9 million or about $0.12 per common share."
65,"PAVmed Inc., Q4 2019 Earnings Call, Apr 09, 2020",Presentation,65,Dennis M. McGrath,"President, CFO & Secretary",EXECUTIVES,"PAVmed had cash of $6.2 million as of December 31, 2019. Subsequent to the year-end and just last week, the company received net proceeds of approximately $6 million from the prepayment of the investor notes received in the November private placement transaction with 2 institutional investors. You will recall, the company entered into a Series B senior secured convertible note with each of the Series A investors that gave us this option for an additional $6 million. That funding, last week, was in connection with these previously announced Series B investor notes."
66,"PAVmed Inc., Q4 2019 Earnings Call, Apr 09, 2020",Presentation,66,Dennis M. McGrath,"President, CFO & Secretary",EXECUTIVES,"Our cash balance at March 31 is approximately $8.5 million, and we're very confident that we will continue to have access to additional funding to finance our ongoing operations as needed, which Lishan has alluded to earlier in the prepared remarks."
67,"PAVmed Inc., Q4 2019 Earnings Call, Apr 09, 2020",Presentation,67,Dennis M. McGrath,"President, CFO & Secretary",EXECUTIVES,"Furthermore, as of January 2020, we accumulatively paid down approximately $7.7 million of the previous December 2018 senior convertible debt, which had an initial balance of just under $8 million at the outset and leaves a remaining balance of $50,000. So with that, operator, we could open it up to additional questions from our audience."
